{
  "schema_version": "1.0",
  "catalog_schema_version": "1.0",
  "rule_count": 35,
  "case_count": 78,
  "scale_case_count": 8,
  "acceptance_budgets": {
    "minimum_statement_coverage_percent": 90.0,
    "minimum_branch_coverage_percent": 85.0,
    "required_functional_pass_rate": 1.0,
    "required_malformed_rejection_rate": 1.0,
    "require_scale_determinism": true,
    "wall_clock_gate_enabled": false
  },
  "cases": [
    {
      "id": "IAM-001-positive",
      "module": "iam",
      "classification": "positive",
      "profile": "rule:IAM-001:positive",
      "covers_rules": [
        "IAM-001"
      ],
      "description": "Minimal deterministic evidence that exercises IAM-001.",
      "expected_findings": [
        {
          "rule_id": "IAM-001",
          "severity": "critical",
          "resource_type": "role",
          "resource_id": "positive-iam-001",
          "count": 1
        },
        {
          "rule_id": "IAM-003",
          "severity": "medium",
          "resource_type": "role",
          "resource_id": "positive-iam-001",
          "count": 1
        }
      ],
      "false_positive_rationale": "The analyzer observes an explicit Allow with both Action and Resource set to a full wildcard. The benchmark proves rule matching, not that the observed condition is malicious.",
      "unsupported_evidence": [
        "Effective authorization across SCPs, RCPs, resource policies, session policies, and explicit denies is not fully modeled.",
        "Credential posture is limited to the supplied snapshot and does not prove credential compromise."
      ]
    },
    {
      "id": "IAM-001-boundary",
      "module": "iam",
      "classification": "boundary",
      "profile": "rule:IAM-001:boundary",
      "covers_rules": [
        "IAM-001"
      ],
      "description": "Near-miss or exact-threshold evidence for IAM-001.",
      "expected_findings": [
        {
          "rule_id": "IAM-002",
          "severity": "high",
          "resource_type": "role",
          "resource_id": "boundary-iam-001",
          "count": 1
        }
      ],
      "false_positive_rationale": "The profile isolates the decision boundary for IAM-001; companion findings remain explicit, but this rule must not cross its documented boundary.",
      "unsupported_evidence": [
        "Effective authorization across SCPs, RCPs, resource policies, session policies, and explicit denies is not fully modeled.",
        "Credential posture is limited to the supplied snapshot and does not prove credential compromise."
      ]
    },
    {
      "id": "IAM-002-positive",
      "module": "iam",
      "classification": "positive",
      "profile": "rule:IAM-002:positive",
      "covers_rules": [
        "IAM-002"
      ],
      "description": "Minimal deterministic evidence that exercises IAM-002.",
      "expected_findings": [
        {
          "rule_id": "IAM-002",
          "severity": "high",
          "resource_type": "role",
          "resource_id": "positive-iam-002",
          "count": 1
        }
      ],
      "false_positive_rationale": "The action pattern is explicit policy evidence; severity rises for full or service-wide wildcards. The benchmark proves rule matching, not that the observed condition is malicious.",
      "unsupported_evidence": [
        "Effective authorization across SCPs, RCPs, resource policies, session policies, and explicit denies is not fully modeled.",
        "Credential posture is limited to the supplied snapshot and does not prove credential compromise."
      ]
    },
    {
      "id": "IAM-002-boundary",
      "module": "iam",
      "classification": "boundary",
      "profile": "rule:IAM-002:boundary",
      "covers_rules": [
        "IAM-002"
      ],
      "description": "Near-miss or exact-threshold evidence for IAM-002.",
      "expected_findings": [],
      "false_positive_rationale": "The profile isolates the decision boundary for IAM-002; companion findings remain explicit, but this rule must not cross its documented boundary.",
      "unsupported_evidence": [
        "Effective authorization across SCPs, RCPs, resource policies, session policies, and explicit denies is not fully modeled.",
        "Credential posture is limited to the supplied snapshot and does not prove credential compromise."
      ]
    },
    {
      "id": "IAM-003-positive",
      "module": "iam",
      "classification": "positive",
      "profile": "rule:IAM-003:positive",
      "covers_rules": [
        "IAM-003"
      ],
      "description": "Minimal deterministic evidence that exercises IAM-003.",
      "expected_findings": [
        {
          "rule_id": "IAM-003",
          "severity": "medium",
          "resource_type": "role",
          "resource_id": "positive-iam-003",
          "count": 1
        }
      ],
      "false_positive_rationale": "The Resource wildcard is explicit, although some AWS actions do not support resource-level scoping. The benchmark proves rule matching, not that the observed condition is malicious.",
      "unsupported_evidence": [
        "Effective authorization across SCPs, RCPs, resource policies, session policies, and explicit denies is not fully modeled.",
        "Credential posture is limited to the supplied snapshot and does not prove credential compromise."
      ]
    },
    {
      "id": "IAM-003-boundary",
      "module": "iam",
      "classification": "boundary",
      "profile": "rule:IAM-003:boundary",
      "covers_rules": [
        "IAM-003"
      ],
      "description": "Near-miss or exact-threshold evidence for IAM-003.",
      "expected_findings": [],
      "false_positive_rationale": "The profile isolates the decision boundary for IAM-003; companion findings remain explicit, but this rule must not cross its documented boundary.",
      "unsupported_evidence": [
        "Effective authorization across SCPs, RCPs, resource policies, session policies, and explicit denies is not fully modeled.",
        "Credential posture is limited to the supplied snapshot and does not prove credential compromise."
      ]
    },
    {
      "id": "IAM-004-positive",
      "module": "iam",
      "classification": "positive",
      "profile": "rule:IAM-004:positive",
      "covers_rules": [
        "IAM-004"
      ],
      "description": "Minimal deterministic evidence that exercises IAM-004.",
      "expected_findings": [
        {
          "rule_id": "IAM-004",
          "severity": "high",
          "resource_type": "role",
          "resource_id": "positive-iam-004",
          "count": 1
        }
      ],
      "false_positive_rationale": "The policy grants broad S3 write capability, but effective access can still be reduced by boundaries, resource policies, or explicit denies. The benchmark proves rule matching, not that the observed condition is malicious.",
      "unsupported_evidence": [
        "Effective authorization across SCPs, RCPs, resource policies, session policies, and explicit denies is not fully modeled.",
        "Credential posture is limited to the supplied snapshot and does not prove credential compromise."
      ]
    },
    {
      "id": "IAM-004-boundary",
      "module": "iam",
      "classification": "boundary",
      "profile": "rule:IAM-004:boundary",
      "covers_rules": [
        "IAM-004"
      ],
      "description": "Near-miss or exact-threshold evidence for IAM-004.",
      "expected_findings": [],
      "false_positive_rationale": "The profile isolates the decision boundary for IAM-004; companion findings remain explicit, but this rule must not cross its documented boundary.",
      "unsupported_evidence": [
        "Effective authorization across SCPs, RCPs, resource policies, session policies, and explicit denies is not fully modeled.",
        "Credential posture is limited to the supplied snapshot and does not prove credential compromise."
      ]
    },
    {
      "id": "IAM-005-positive",
      "module": "iam",
      "classification": "positive",
      "profile": "rule:IAM-005:positive",
      "covers_rules": [
        "IAM-005"
      ],
      "description": "Minimal deterministic evidence that exercises IAM-005.",
      "expected_findings": [
        {
          "rule_id": "IAM-005",
          "severity": "medium",
          "resource_type": "user",
          "resource_id": "positive-iam-005",
          "count": 1
        }
      ],
      "false_positive_rationale": "The statement lacks an MFA condition, but other identity controls or session policies may still require MFA. The benchmark proves rule matching, not that the observed condition is malicious.",
      "unsupported_evidence": [
        "Effective authorization across SCPs, RCPs, resource policies, session policies, and explicit denies is not fully modeled.",
        "Credential posture is limited to the supplied snapshot and does not prove credential compromise."
      ]
    },
    {
      "id": "IAM-005-boundary",
      "module": "iam",
      "classification": "boundary",
      "profile": "rule:IAM-005:boundary",
      "covers_rules": [
        "IAM-005"
      ],
      "description": "Near-miss or exact-threshold evidence for IAM-005.",
      "expected_findings": [],
      "false_positive_rationale": "The profile isolates the decision boundary for IAM-005; companion findings remain explicit, but this rule must not cross its documented boundary.",
      "unsupported_evidence": [
        "Effective authorization across SCPs, RCPs, resource policies, session policies, and explicit denies is not fully modeled.",
        "Credential posture is limited to the supplied snapshot and does not prove credential compromise."
      ]
    },
    {
      "id": "IAM-006-positive",
      "module": "iam",
      "classification": "positive",
      "profile": "rule:IAM-006:positive",
      "covers_rules": [
        "IAM-006"
      ],
      "description": "Minimal deterministic evidence that exercises IAM-006.",
      "expected_findings": [
        {